<?xml version="1.0" encoding="UTF-8"?>
<Candy xmlns:xsi="http://www.w3.org/2001/XMLSchema-instance"
       xsi:noNamespaceSchemaLocation="candies.xsd">
    <CandyType>
        <Name>Мармеладка</Name>
        <Energy>300</Energy>
        <Type>ирис</Type>
        <Ingredients>
            <Water>10</Water>
            <Sugar>20</Sugar>
            <Fructose>5</Fructose>
            <ChocolateType>молочный</ChocolateType>
            <Vanillin>2</Vanillin>
        </Ingredients>
        <Value>
            <Proteins>3.5</Proteins>
            <Fats>2.0</Fats>
            <Carbohydrates>25.5</Carbohydrates>
        </Value>
        <Production>Кондитерская «Сладости»</Production>
    </CandyType>
    <CandyType>
        <Name>Шоколадка</Name>
        <Energy>500</Energy>
        <Type>шоколадная</Type>
        <Ingredients>
            <Water>5</Water>
            <Sugar>30</Sugar>
            <Fructose>8</Fructose>
            <ChocolateType>темный</ChocolateType>
            <Vanillin>0</Vanillin>
        </Ingredients>
        <Value>
            <Proteins>4.0</Proteins>
            <Fats>30.0</Fats>
            <Carbohydrates>60.0</Carbohydrates>
        </Value>
        <Production>Фабрика «Сладкий уголок»</Production>
    </CandyType>
</Candy>
